[
  {
    "wikidata_id": "Q3378640",
    "title": "Phoenix Wright: Ace Attorney",
    "media_type": "game",
    "creator": "Shu Takumi",
    "year": 2001,
    "series_name": "Ace Attorney",
    "series_number": 1,
    "tags": ["mystery", "courtroom", "visual-novel", "whodunit"],
    "notes": "Original GBA/DS game featuring five cases. The DS version adds the bonus case Rise from the Ashes.",
    "persons": [
      { "name": "Phoenix Wright", "role_in_story": "protagonist", "is_fictional": true, "notes": "Defense attorney, main playable character." },
      { "name": "Mia Fey", "role_in_story": "detective", "is_fictional": true, "notes": "Phoenix's mentor and senior attorney at Fey & Co. Law Offices." },
      { "name": "Miles Edgeworth", "role_in_story": "antagonist", "is_fictional": true, "notes": "Ruthless prosecutor, later revealed to have a complex past." },
      { "name": "Manfred von Karma", "role_in_story": "antagonist", "is_fictional": true, "notes": "Legendary prosecutor and true villain of the game." },
      { "name": "Cindy Stone", "role_in_story": "victim", "is_fictional": true, "notes": "Frank Sahwit's victim in The First Turnabout." },
      { "name": "Frank Sahwit", "role_in_story": "antagonist", "is_fictional": true, "notes": "Killer in The First Turnabout; posed as a newspaper salesman." },
      { "name": "Maya Fey", "role_in_story": "bystander", "is_fictional": true, "notes": "Mia's younger sister, spirit medium, and Phoenix's assistant." },
      { "name": "Redd White", "role_in_story": "antagonist", "is_fictional": true, "notes": "CEO of Bluecorp; killed Mia Fey to silence her." },
      { "name": "Jack Hammer", "role_in_story": "victim", "is_fictional": true, "notes": "Veteran actor on the set of Steel Samurai." },
      { "name": "Dee Vasquez", "role_in_story": "antagonist", "is_fictional": true, "notes": "Studio producer; killed Jack Hammer in self-defense." },
      { "name": "Robert Hammond", "role_in_story": "victim", "is_fictional": true, "notes": "Defense attorney shot dead at Gourd Lake." },
      { "name": "Yogi (Yanni Yogi)", "role_in_story": "antagonist", "is_fictional": true, "notes": "Former bailiff who killed Robert Hammond out of revenge." },
      { "name": "Gregory Edgeworth", "role_in_story": "victim", "is_fictional": true, "notes": "Miles Edgeworth's father; killed in the DL-6 Incident elevator." },
      { "name": "Neil Marshall", "role_in_story": "victim", "is_fictional": true, "notes": "Detective killed by Joe Darke; his death was covered up by Damon Gant. (Rise from the Ashes)" },
      { "name": "Joe Darke", "role_in_story": "antagonist", "is_fictional": true, "notes": "Serial killer executed for multiple murders; accidentally killed Neil Marshall." },
      { "name": "Damon Gant", "role_in_story": "antagonist", "is_fictional": true, "notes": "Chief of police who killed Neil Marshall to conceal evidence and blackmail Lana. (Rise from the Ashes)" },
      { "name": "Lana Skye", "role_in_story": "bystander", "is_fictional": true, "notes": "Chief prosecutor; Ema's sister, blackmailed by Damon Gant. (Rise from the Ashes)" },
      { "name": "Bruce Goodman", "role_in_story": "victim", "is_fictional": true, "notes": "Detective murdered by Damon Gant when he tried to re-open the SL-9 case. (Rise from the Ashes)" }
    ],
    "deaths": [
      {
        "victim_name": "Cindy Stone",
        "killer_name": "Frank Sahwit",
        "cause": "CLUBBED",
        "death_type": "murder",
        "motive": "concealment",
        "is_central_death": true,
        "is_twist": false,
        "ordinal": 1,
        "notes": "Case 1 – The First Turnabout. Cindy was struck with a clock while Frank Sahwit was robbing her apartment."
      },
      {
        "victim_name": "Mia Fey",
        "killer_name": "Redd White",
        "cause": "CLUBBED",
        "death_type": "murder",
        "motive": "concealment",
        "is_central_death": true,
        "is_twist": false,
        "ordinal": 2,
        "notes": "Case 2 – Turnabout Sisters. Mia was struck with a glass trophy by Redd White to prevent her from exposing him."
      },
      {
        "victim_name": "Jack Hammer",
        "killer_name": "Dee Vasquez",
        "cause": "FELL",
        "death_type": "manslaughter",
        "motive": "self_defense",
        "is_central_death": true,
        "is_twist": true,
        "ordinal": 3,
        "notes": "Case 3 – Turnabout Samurai. Jack Hammer fell onto a fence spike after Dee Vasquez pushed him in self-defense during his attempt on her life."
      },
      {
        "victim_name": "Robert Hammond",
        "killer_name": "Yogi (Yanni Yogi)",
        "cause": "SHOT",
        "death_type": "murder",
        "motive": "revenge",
        "is_central_death": true,
        "is_twist": false,
        "ordinal": 4,
        "notes": "Case 4 – Turnabout Goodbyes. Yogi shot Hammond at Gourd Lake as revenge for Hammond's poor defense that left him faking insanity for 15 years."
      },
      {
        "victim_name": "Gregory Edgeworth",
        "killer_name": "Manfred von Karma",
        "cause": "SHOT",
        "death_type": "murder",
        "motive": "revenge",
        "is_central_death": false,
        "is_twist": true,
        "ordinal": 5,
        "notes": "Case 4 – DL-6 Incident (15 years prior). Manfred von Karma shot Gregory Edgeworth in a stalled elevator, framing Yanni Yogi."
      },
      {
        "victim_name": "Neil Marshall",
        "killer_name": "Joe Darke",
        "cause": "STABBED",
        "death_type": "accident",
        "motive": "concealment",
        "is_central_death": false,
        "is_twist": true,
        "ordinal": 6,
        "notes": "Case 5 – Rise from the Ashes (SL-9 Incident). Joe Darke accidentally killed detective Neil Marshall during a struggle."
      },
      {
        "victim_name": "Neil Marshall",
        "killer_name": "Damon Gant",
        "cause": "STABBED",
        "death_type": "murder",
        "motive": "concealment",
        "is_central_death": false,
        "is_twist": true,
        "ordinal": 7,
        "notes": "Case 5 – Rise from the Ashes. Damon Gant stabbed Neil Marshall a second time to ensure his death and fabricate evidence to blackmail Lana Skye."
      },
      {
        "victim_name": "Bruce Goodman",
        "killer_name": "Damon Gant",
        "cause": "STABBED",
        "death_type": "murder",
        "motive": "concealment",
        "is_central_death": true,
        "is_twist": false,
        "ordinal": 8,
        "notes": "Case 5 – Rise from the Ashes. Damon Gant killed Detective Goodman to prevent the SL-9 case from being re-investigated."
      }
    ]
  },
  {
    "wikidata_id": "Q918403",
    "title": "Phoenix Wright: Ace Attorney – Justice for All",
    "media_type": "game",
    "creator": "Shu Takumi",
    "year": 2002,
    "series_name": "Ace Attorney",
    "series_number": 2,
    "tags": ["mystery", "courtroom", "visual-novel", "whodunit"],
    "notes": "Second game in the series, featuring four cases including the fan-favourite Farewell, My Turnabout.",
    "persons": [
      { "name": "Phoenix Wright", "role_in_story": "protagonist", "is_fictional": true, "notes": "Defense attorney, main playable character." },
      { "name": "Mia Fey", "role_in_story": "detective", "is_fictional": true, "notes": "Phoenix's deceased mentor; channels through Maya during some cases." },
      { "name": "Maya Fey", "role_in_story": "bystander", "is_fictional": true, "notes": "Phoenix's assistant and spirit medium; held hostage in Case 4." },
      { "name": "Miles Edgeworth", "role_in_story": "detective", "is_fictional": true, "notes": "Prosecutor who returns in Case 4 to assist Phoenix." },
      { "name": "Turner Grey", "role_in_story": "victim", "is_fictional": true, "notes": "Doctor killed during a spirit channeling session in Case 1." },
      { "name": "Mimi Miney", "role_in_story": "antagonist", "is_fictional": true, "notes": "Nurse who killed Turner Grey; posed as her dead sister Morgan's spirit." },
      { "name": "Morgan Fey", "role_in_story": "antagonist", "is_fictional": true, "notes": "Fey clan elder who orchestrated the spirit channeling trap; Pearl's mother." },
      { "name": "Russell Berry", "role_in_story": "victim", "is_fictional": true, "notes": "Ringmaster of the Gatewater Land circus, found dead in Case 2." },
      { "name": "Acro (Ken Dingling)", "role_in_story": "antagonist", "is_fictional": true, "notes": "Circus acrobat who killed Russell Berry by mistake while aiming at Regina." },
      { "name": "Regina Berry", "role_in_story": "bystander", "is_fictional": true, "notes": "Russell Berry's daughter and animal tamer; Acro's intended target." },
      { "name": "Bat (Billy Bite)", "role_in_story": "victim", "is_fictional": true, "notes": "Acro's younger brother who was mauled by a lion while trying to prank Regina; in a coma." },
      { "name": "Juan Corrida", "role_in_story": "victim", "is_fictional": true, "notes": "Rival actor to Matt Engarde; killed in Case 4 by Shelly de Killer." },
      { "name": "Matt Engarde", "role_in_story": "antagonist", "is_fictional": true, "notes": "Actor who hired the assassin Shelly de Killer to murder Juan Corrida." },
      { "name": "Shelly de Killer", "role_in_story": "antagonist", "is_fictional": true, "notes": "Professional assassin hired by Matt Engarde to kill Juan Corrida." },
      { "name": "Adrian Andrews", "role_in_story": "bystander", "is_fictional": true, "notes": "Manager of Juan Corrida; initially suspected of his murder." },
      { "name": "Franziska von Karma", "role_in_story": "antagonist", "is_fictional": true, "notes": "Prosecutor in Cases 1–3; Manfred von Karma's daughter." }
    ],
    "deaths": [
      {
        "victim_name": "Turner Grey",
        "killer_name": "Mimi Miney",
        "cause": "SHOT",
        "death_type": "murder",
        "motive": "concealment",
        "is_central_death": true,
        "is_twist": true,